{
  "schemaVersion": "explainer-kit.theme/v1",
  "name": "neutral-clean",
  "defaultMode": "light",
  "modes": {
    "light": {
      "surface": {
        "canvas": "#ffffff",
        "panel": "#f3f4f6",
        "elevated": "#e5e7eb"
      },
      "ink": { "primary": "#111827", "muted": "#4b5563", "inverse": "#ffffff" },
      "accent": { "primary": "#374151", "secondary": "#4b5563" },
      "status": {
        "success": "#166534",
        "warning": "#854d0e",
        "danger": "#991b1b",
        "info": "#1e40af"
      },
      "diagramSeries": ["#374151", "#1e40af", "#166534", "#854d0e"]
    },
    "dark": {
      "surface": {
        "canvas": "#111827",
        "panel": "#1f2937",
        "elevated": "#374151"
      },
      "ink": { "primary": "#f9fafb", "muted": "#d1d5db", "inverse": "#111827" },
      "accent": { "primary": "#d1d5db", "secondary": "#e5e7eb" },
      "status": {
        "success": "#86efac",
        "warning": "#fde047",
        "danger": "#fca5a5",
        "info": "#93c5fd"
      },
      "diagramSeries": ["#d1d5db", "#93c5fd", "#86efac", "#fde047"]
    }
  },
  "provenance": {
    "palette": "neutral",
    "visualProfile": "clean",
    "derived": false
  },
  "typography": {
    "sans": ["system-ui", "-apple-system", "BlinkMacSystemFont", "sans-serif"],
    "serif": ["ui-serif", "Georgia", "serif"],
    "mono": ["ui-monospace", "SFMono-Regular", "Consolas", "monospace"],
    "scale": {
      "caption": "0.875rem",
      "body": "1rem",
      "title": "1.5rem",
      "display": "2.25rem"
    },
    "lineHeight": { "caption": 1.4, "body": 1.6, "title": 1.25, "display": 1.1 }
  },
  "spacing": {
    "unit": 4,
    "scale": { "xs": 4, "sm": 8, "md": 16, "lg": 24, "xl": 40 }
  },
  "geometry": {
    "radius": { "sm": 4, "md": 8, "lg": 12 },
    "borderWidth": 1
  },
  "elevation": {
    "shadows": {
      "low": "0 1px 2px rgb(0 0 0 / 0.08)",
      "high": "0 12px 28px rgb(0 0 0 / 0.16)"
    }
  },
  "density": "comfortable",
  "motion": {
    "enabled": true,
    "durationMs": { "fast": 120, "normal": 200, "slow": 320 },
    "easing": {
      "standard": "ease",
      "emphasized": "cubic-bezier(0.2, 0, 0, 1)"
    },
    "reducedMotion": "disable-nonessential"
  },
  "diagrams": {
    "lineWidth": 2,
    "nodeGap": 32,
    "arrowStyle": "straight",
    "labelTreatment": "boxed"
  },
  "bundleHash": "sha256:7e7b935c2a6d1603fe4e9fb6bdd32859d3a8fc558db38a7b3289d78e8c1396b3"
}
